T1_SE_translated;T1_ELF_translated;T2_SE_translated;T2_ELF_translated
;;;
Der Einfluss der sozialen Information über Verhalten ist in einer Varietät von Settings gezeigt worden. ;;;
Zum Beispiel zeigt die Forschung, dass wenn man den Menschen aufzeigt, wie ihre Handlungen im Verhältnis zu demjenigen anderer, ähnlicher Menschen stehen, dies die Leute ermutigt, ihren Energie- und Wasserverbrach anzupassen, ebenso  wie ihre Beiträge zu wohltätigen Zwecken und ihre Vorsorgeentscheidungen. ;;;
Trotz einem wachsenden Interessan an der Erforschung sozialer Vergleiche bleiben jedoch mehrere Fragen offen. ;;;
Insbesondere ist relativ wenig bekannt über die ;;;
;;;Solche Berater sind speziell trainiert, die Pilot-Aktionen durch Erziehung der Energie-verletzlichen Konsumenten (VCs) zu optimieren (und, nach Möglichkeit, zu reduzieren), hauptsächlich durch Verhaltensänderungen.
;;;Das Energy Consumption Research Institute ist im Projekt verantwortlich für das technische Training der HEAs und die Planung der Pilot-Aktionen. 
;;;Dieser Artikel präsentiert die ersten Resultate der oben erwähnten Aufgaben. 
;;;Der erste Teil des Artikels fasst die Resul
