T1_SE_translated;T1_ELF_translated;T2_SE_translated;T2_ELF_translated
;;;
;Der Einfluss sozialer Informationen auf das Verhalten wurde in einer Reihe verschiedener Settings aufgezeigt.;;
;Forschungsstudien wiesen nach, dass Menschen, wenn ihre Handlungsweisen mit denen ähnlicher Personen verglichen werden, zu einer Aenderung ihres Energie- und Wasserverbrauchs, ;;
;;;
;;Vor diesem Hintergrund verfolgt das (von der EU Commission im Sinne des Grant Agreement Nr. 12345 finanzierte) Projekt, an dem das Energy Consumption Research Institute beteiligt ist, das Ziel, Best Practices und Empfehlungen zur Minderung der Energiearmut bekanntzugeben.;
;;Hierfür wird gemeinsam mit einer Beratergruppe, den sogenannten HEAs (Home Energy Advisors;
