T1_SE_translated;T1_ELF_translated;T2_SE_translated;T2_ELF_translated
;;;
Der Einfluss von sozialen Aspekten auf das Verhalten wurde in einer Mehrzahl von Situationen gezeigt.;;;Energiearmut ist eine der grundlegenden sozialen, technischen und rechtlichen Herausforderungen in Europa heutzutage. Das Problem betrifft schätzungsweise  50 bis 125 Millionen Menschen.
Die Forschung zeigt beispielsweise, dass es einen Einfluss auf Menschen hat, wenn man ihnen sagt, wie andere Menschen, die ihnen ähnlich sind, handeln. So ändern sie zum Beispiel ihren Energie- oder Wasserverbrauch, ihre gemeinnützigen Tätigkeiten oder Spenden sowie ihre Sparentscheidungen.;;;Die European Commission (EC) hat schon viel Arbeit darin investiert, dieses Problem zu lösen. Das zeigt sich am Beispiel des kürzlich gegründeten EU Energy Poverty Observatory im Januar 2018.
Trotz des steigenden Interesses an sozialer, komparativer Forschung bleiben jedoch viele Fragen unbeantwortet.;;;"EC betont insbesondere, dass es wichtig sei, von den Erfahrungen und ""best practices"" der verschiedenen Members states (MS) zu lernen."
Es ist insbesondere wenig darüber bekannt über die Gründed der Heterogenität ;;;Das
