T1_SE_translated;T1_ELF_translated;T2_SE_translated;T2_ELF_translated
;;;
Der Einfluss sozialer Informationen auf das Verhalten  konnte in mehreren Settings aufgezeigt werden.;;;
So konnte di Forschung beispielsweise veranschaulichen, dass die Tatsache, dass den Leuten mitgeteilt wird, wie sie im Vegleich zu anderen abschneiden,;;;
;;;
;;;In diesem Sinne  zielt das (von der EU-Kommission unter dem Grant Agreement n. ) gegründete Projekt, dessen Partner das Energy Consumptiom Research Institut  ist, darauf ab,
