"rand_index","index","translation","reference_translation","accuracy"
302,125,"Der HER liefert verschiedene Elemente, von einem statischen Vergleich im Bereich Energieverbrauch (deskritpive Norm) über Informationen dazu, wie gut einzelne Personen sind (injunktive Norm) bis zu Energiespartips.","Der HER enthält verschiedene Elemente, unter anderem einen statischen Nachbarschaftsvergleich des Energieverbrauchniveaus (deskriptive Norm), Rückmeldungen dazu, wie man selbst abschneidet (injunktive Norm) und Energiespartipps.",""
303,196,"Der Einfluss von sozialien Information auf das Benehmen wurde in verschiedenen Situationen gezeigt.","Der Einfluss von sozialen Informationen auf das Verhalten wurde bereits in diversen Bereichen nachgewiesen.",""
304,292,"Die European Commission (EC) hat durch die Lancierung des EU Energy Poverty Observatory in Januar 2018 gezeigt, wie viel Effort momentan in die Lösung dieses Problems investiert wird.","Die Europäische Kommission bemüht sich sehr, Lösungen für die Probleme zu finden, beispielsweise mit der im Januar 2018 gegründeten EU-Beobachtungsstelle für Energiearmut.",""
305,156,"Der Einfluss sozialer Informationen auf das Verhalten wurde in verschiedenen Situationen gezeigt.","Der Einfluss von sozialen Informationen auf das Verhalten wurde bereits in diversen Bereichen nachgewiesen.",""
306,493,"Das grösste Hindernis beim Durchführen dieser Analyse ist, dass die Daten, welche häufig als Standardindikatoren verwendet werden ( bspw. Tiefes-Einkommen, Hohe-Kosten), in vielen Ländern fehlen. Dadruch müssen neue Wege zur Bestimmung eines ""energie-verletzlichen-Ko","Im ersten Teil dieses Artikels werden die Resultate einer statistischen Analyse zusammengefasst, die durchgeführt wurde, um die Begriffe «energiearme» und «energiegefährdete» Konsumentinnen und Konsumenten zu definieren, da es in Europa keine einheitliche Definition gibt.",""
307,519,"Der erste Teil des Artikels fa","Im ersten Teil dieses Artikels werden die Resultate einer statistischen Analyse zusammengefasst, die durchgeführt wurde, um die Begriffe «energiearme» und «energiegefährdete» Konsumentinnen und Konsumenten zu definieren, da es in Europa keine einheitliche Definition gibt.",""
308,9,"So zeigt die Studie zum Beispiel, dass, wenn Menschen ihr Verhalten mit dem Anderer vergleichen, ähnliche Menschen dazu ermutigt werden, ihr Energie- und Wasserverbrauch, ihre Mithilfe an gemeinnützigen Projekten und ihr Sparverhalten zu ändern.","Forschungsergebnisse zeigen beispielsweise auf, dass Personen motivierter sind, ihren Energie- und Wasserverbrauch, ihr Spenden- und Sparverhalten zu verändern, wenn ihr Verhalten mit dem von ihnen vergleichbaren Personen direkt verglichen wird.",""
309,145,"Während umweltbezogene Werte in der Regel während des ganzen Lebens stabil bleiben, kann die umweltbezogene Selbstidentität beeinflusst werden, zum Beispiel durch Informationen in Bezug auf das Energiesparen.","Während ökologische Werte ein Leben lang mehr oder weniger unverändert bleiben, kann ökologische Selbstidentität beispielweise durch Informationen zu Energiesparmassnahmen beeinflusst werden.",""
310,517,"In diesem Projekt ist das Energy Consumption Forschungsinstitut verantwortlich für das technische Training der HEAs und für die Planung der Pilotaktionen.","Im Rahmen dieses Projektes ist es die Aufgabe des Forschungsinstituts für Energienutzung, die HEAs fachlich auszubilden sowie die Pilotmassnahmen zu planen.",""
311,106,"Zunächst testen wir, ob durch HER die Wahrnehmung des Einzelnen","Zuerst wird getestet, ob der HER beeinflusst, wie Einzelpersonen Normen im Bereich des Energiesparens wahrnehmen.",""
312,114,"Ein zweiter Mechanismus könnte deshalb sein, dass die Informationen, die der HER liefert, die Selbstidentität bezüglich Umwelt  bei den Konsumenten beeinflusst.","Ein zweiter Mechanismus könnte also sein, dass die im HER enthaltenen Informationen die ökologische Selbstidentität der Konsumentinnen und Konsumenten stärken.",""
313,42,"Wir testen zunächst, ob HER die individuelle Wahrnehmung von Normen im Bereich des Energiesparens beeinflusst-","Zuerst wird getestet, ob der HER beeinflusst, wie Einzelpersonen Normen im Bereich des Energiesparens wahrnehmen.",""
314,38,"Während umwelt","Während ökologische Werte ein Leben lang mehr oder weniger unverändert bleiben, kann ökologische Selbstidentität beispielweise durch Informationen zu Energiesparmassnahmen beeinflusst werden.",""
315,26,"Ein zweites Ziel der Arbeit ist das Testen möglicher Mechanismen, die zur Wirkung von HER beitragen.","Ein weiteres Ziel dieser Studie ist es, mögliche Mechanismen zu überprüfen, um die Wirksamkeit des HER steigern zu können.",""
316,325,"Der erste Teil des Papers fasst die Ergebnisse einer statistischen Analyse zusammen, die ""energiearme"" oder ""energiegefährdete"" Konsumenten definieren sollte, da eine gemeinsame europäische Definition nicht existiert.","Im ersten Teil dieses Artikels werden die Resultate einer statistischen Analyse zusammengefasst, die durchgeführt wurde, um die Begriffe «energiearme» und «energiegefährdete» Konsumentinnen und Konsumenten zu definieren, da es in Europa keine einheitliche Definition gibt.",""
317,86,"Zuerst wird getestet, ob der HER die Wahrnehmung der Norm durch die Einzelpersonen im Berich Energiesparen formt.","Zuerst wird getestet, ob der HER beeinflusst, wie Einzelpersonen Normen im Bereich des Energiesparens wahrnehmen.",""
318,79,"Zweitens bleiben umweltbezogene Einstellungen während des Lebens mehrheitlich stabil, während umweltbezogene Selbstidentität beeinflusst werden kann, beispielsweise durch Informationen über den Energieverbrauch.","Während ökologische Werte ein Leben lang mehr oder weniger unverändert bleiben, kann ökologische Selbstidentität beispielweise durch Informationen zu Energiesparmassnahmen beeinflusst werden.",""
319,257,"Während das Bewahru","Während das Umweltschutzverhalten von Menschen mit ausgeprägten biosphärischen Werten in der Literatur gut dokumentiert ist, weiss man relativ wenig darüber, wie Konsumentinnen und Konsumenten auf Peer-Vergleiche reagieren.",""
320,441,"Desweiteren ist es so, dass die Erhältlichkeit der verschiedenen Daten von Eu Ländern oft fragmentiert und nicht vergleichbar aufgeteilt ist in den verschiedenen Mi","Das grösste Problem bei der Durchführung der Analyse war, dass viele Daten, die häufig als Standardindikatoren genutzt werden (z. B. niedriges Einkommen und hohe Ausgaben), in zahlreichen Ländern nicht verfügbar sind. Somit muss neu definiert werden, was energiegefährdete Konsumentinnen und Konsumenten ausmacht.",""
321,154,"Eine weitere entscheidende Forschungslücke ist das fehlendeVerständnis der Mechanimen hinter der Reaktion einzelner zum Opower Home Energy Report (HER) im Bereich Energieverbrauch.","Eine weitere Forschungslücke ist das mangelnde Verständnis für die Mechanismen hinter den Reaktionen einer Person auf den Opower-HER in Hinsicht auf ihren Energieverbrauch. ",""
322,20,"Der Einfluss sozialer Information auf das Verhalten wurde in einer Reihe von settings demonstriert.","Der Einfluss von sozialen Informationen auf das Verhalten wurde bereits in diversen Bereichen nachgewiesen.",""
323,396,"Um dieses Problem zu lösen, ist es nötig, einen Hintergrund zu definieren, gegen den die Pilotmassnahmen umgeset","Um dieses Problem zu lösen, musste der Kontext definiert werden, in dem die Pilotmassnahmen implementiert werden sollen (die Situation in den analysierten EU-Mitgliedsstaaten). Auch musste eine zielgerichtete Marktsegmentierung durchgeführt werden, mittels einer Analyse und Ergänzung von verfügbaren Datenbeständen, welche ähnliche und kompatible Indikatoren aufweisen.",""
324,255,"Insbesondere, weiss man relative wenig über den Ursprung der Heterogenität in Bezug auf den Effekt eines wohlbekannten Experimentes mit sozialen Vergleichen, wie es im Opower Programm zur Verfügung gestellt wird.","Insbesondere ist relativ wenig bekannt über die Ursachen der Heterogenität, die in den Auswirkungen von typischen Sozialvergleichsexperimenten beobachtet wurden – wie etwa beim Programm Haushalt-Elektrizitäts-Report (HER) von Opower.",""
325,214,"Zum Beispiel, Forschungen zeigen dass das vergleichen von Handlungen mit denen Anderer, ähnliche Menschen ermutigt ihren Energie- und Wasserverbrauch an zu passen, ihre Beteiligung an gutnützige Ziele, und sparr Entscheidungen anzupassen.","Forschungsergebnisse zeigen beispielsweise auf, dass Personen motivierter sind, ihren Energie- und Wasserverbrauch, ihr Spenden- und Sparverhalten zu verändern, wenn ihr Verhalten mit dem von ihnen vergleichbaren Personen direkt verglichen wird.",""
326,242,"Zunächst, testen wir ob das HER die Wahrnehmung der Normen des Einzelnen beeinflusst im Bereicht der Energiekonservation.","Zuerst wird getestet, ob der HER beeinflusst, wie Einzelpersonen Normen im Bereich des Energiesparens wahrnehmen.",""
327,351,"Ein Punkt, den die EK besonders hervorgehoben hat, ist die Bedeutung, die dem Lernen aus Erfahrung und aus den Best Practices aus den verschiedenen Mitgliedstaaten (MS) beigemesse","Unter anderem legt die Europäische Kommission besonderen Wert darauf, von der Erfahrung und angewendeter Best Practice verschiedener EU-Mitgliedsstaaten zu lernen.",""
328,459,"Die Europäische Kommission hat eine grosse Menge Arbeit in die Lösung dieses Problems gesteckt, wie gezeigt, zum Beispiel durch die kürzliche Veranstaltung des Eu EnergyPoverty Obsevatory im Janur 2018","Die Europäische Kommission bemüht sich sehr, Lösungen für die Probleme zu finden, beispielsweise mit der im Januar 2018 gegründeten EU-Beobachtungsstelle für Energiearmut.",""
329,216,"Spezifisch, relativ wenig ist bekannt über die Herkunft der Heterogenität des beobachteten Effekts von classic social comparison experiments, wie dem Opowers Home Electricity Report program.","Insbesondere ist relativ wenig bekannt über die Ursachen der Heterogenität, die in den Auswirkungen von typischen Sozialvergleichsexperimenten beobachtet wurden – wie etwa beim Programm Haushalt-Elektrizitäts-Report (HER) von Opower.",""
330,343,"Dies wird durch die Implementierung einer Reihe von Pilotprojekten mit einer Gruppe von sogenannten HEAs (Home Energy Advisors) bewerkstelligt.","Dazu wird eine Reihe von Pilotmassnahmen ergriffen, gemeinsam mit einer Gruppe von Beraterinnen und Beratern, sogenannten Home Energy Advisors (HEAs).",""
331,416,"Diese Berater:innen wurden speziell geschult, um die Pilotaktionen zu implementieren, was die Schulung vulnerabler Konsument:innen beinhaltet, z.B. in der Optimierung und allenfalls Reduktion ihres Energieverbrauchs, und zwar vornhemlich durch Verhaltensänderungen.","Diese HEAs werden eigens dazu ausgebildet, die Pilotmassnahmen umzusetzen und somit gefährdeten Haushalten zu zeigen, wie sie vorwiegend durch Verhaltensänderungen ihren Energieverbrauch optimieren und unter Umständen reduzieren können.",""
332,245,"Zum Beispiel deutet die Forschung darauf hin, dass Menschen, welchen gesagt wird, wie ihr Vehalten sich unterscheidet von demjenigen von anderen, ähnlichen Personen, bezüglich Energie Konsum, Wasserverbrauch, ihren Beiträgen für gemeinnützige Oganisationen und bezüglich ihren Sparmassnahmen, motiviert werden, ihr Verhalten diesbezüglich zu verändern.","Forschungsergebnisse zeigen beispielsweise auf, dass Personen motivierter sind, ihren Energie- und Wasserverbrauch, ihr Spenden- und Sparverhalten zu verändern, wenn ihr Verhalten mit dem von ihnen vergleichbaren Personen direkt verglichen wird.",""
333,69,"Der HER beinhaltet vier wichtige Elem","Der HER enthält verschiedene Elemente, unter anderem einen statischen Nachbarschaftsvergleich des Energieverbrauchniveaus (deskriptive Norm), Rückmeldungen dazu, wie man selbst abschneidet (injunktive Norm) und Energiespartipps.",""
334,415,"Es macht dies, inden es eine Serie von Pilottätigkeiten mit einer Gruppe von Heas (Home Energy Advisors) implementiert. Pilotaktionen oben","Dazu wird eine Reihe von Pilotmassnahmen ergriffen, gemeinsam mit einer Gruppe von Beraterinnen und Beratern, sogenannten Home Energy Advisors (HEAs).",""
335,466,"Die Europäische Kommission hat viel Energie in die Problemlösung gesteckt, wie das Beispiel des neulich lancierten EU Energy Poverty Observatory im Januar 2018, zeigt.","Die Europäische Kommission bemüht sich sehr, Lösungen für die Probleme zu finden, beispielsweise mit der im Januar 2018 gegründeten EU-Beobachtungsstelle für Energiearmut.",""
336,503,"Es macht dies","Dazu wird eine Reihe von Pilotmassnahmen ergriffen, gemeinsam mit einer Gruppe von Beraterinnen und Beratern, sogenannten Home Energy Advisors (HEAs).",""
337,148,"HER beinhaltet verschiedene Elemente, inklusive einem statischen Nachbarsvergleich von Energieverbauchsleveln (eine deskriptive Norm), Feedback auf individuelle Handhabung (eine injunktive Norm), sowie Energiespartipps.","Der HER enthält verschiedene Elemente, unter anderem einen statischen Nachbarschaftsvergleich des Energieverbrauchniveaus (deskriptive Norm), Rückmeldungen dazu, wie man selbst abschneidet (injunktive Norm) und Energiespartipps.",""
338,409,"Zudem führen die verschiedenen in der EU verfügbaren Daten zu einer bruchstückhaften und oft ""nicht kompatiblen"" Segmentierung in einigen Mitgliedsstaaten.","Das grösste Problem bei der Durchführung der Analyse war, dass viele Daten, die häufig als Standardindikatoren genutzt werden (z. B. niedriges Einkommen und hohe Ausgaben), in zahlreichen Ländern nicht verfügbar sind. Somit muss neu definiert werden, was energiegefährdete Konsumentinnen und Konsumenten ausmacht.",""
339,313,"Eines der zentralen Punkte für die EC war die Wichtigkeit","Unter anderem legt die Europäische Kommission besonderen Wert darauf, von der Erfahrung und angewendeter Best Practice verschiedener EU-Mitgliedsstaaten zu lernen.",""
340,512,"Die EC hat viel Aufwand betrieben, um dieses Problem zu lösen, was sich beispielsweise durch die Gründung der EU Energy Poverty Observatory im Januar 2018m gezeigt hat.","Die Europäische Kommission bemüht sich sehr, Lösungen für die Probleme zu finden, beispielsweise mit der im Januar 2018 gegründeten EU-Beobachtungsstelle für Energiearmut.",""
341,248,"Trotz wachsendem Interesse an der Forschunt zu sozialem Vergleich, gibt es weiterhin einige offene Fragen.","Trotz des wachsenden Interesses an sozialer Vergleichsforschung bleiben viele Fragen offen.",""
342,452,"Die Europäische Kommission (EC) hat sich schon sehr stark bemüht, dieses Problem zu lösen. So wie z.B. bei der kürzlichen Einführung des Eu Energy Poverty Ovservatory im Januar 2018.","Die Europäische Kommission bemüht sich sehr, Lösungen für die Probleme zu finden, beispielsweise mit der im Januar 2018 gegründeten EU-Beobachtungsstelle für Energiearmut.",""
343,234,"In unserem Bericht spekulieren wir, dass umweltfreundliche Werte eine wichtige Quelle für Heterogenität im Effekt von den Opower Gruppenvergleich repräsen","In unserer Studie stellen wir die Hypothese auf, dass die ökologischen Werte der Konsumentinnen und Konsumenten eine wichtige Ursache für die heterogenen Effekte sind, die bei den Teilnehmenden der Vergleichsstudie von Opower festgestellt wurden.",""
344,506,"Einer der Aspekte, welche von der EK betont werden, ist die Wichtigkeit, von der Erfahrung und von den in den Mitgliedsta","Unter anderem legt die Europäische Kommission besonderen Wert darauf, von der Erfahrung und angewendeter Best Practice verschiedener EU-Mitgliedsstaaten zu lernen.",""
345,126,"Ein zweites Ziel dieses Artikels ist  es, mögliche Mechanismen zu testen, die den HER wirksam machen.","Ein weiteres Ziel dieser Studie ist es, mögliche Mechanismen zu überprüfen, um die Wirksamkeit des HER steigern zu können.",""
346,55,"Es ist besonders wenig bekannt über die Ursprünge von Heterogenität imzuge eines bekannten Experiments zu sozialem Vergleich, wie etwa das von Dem  Opower-Programm durch den Home Exlectricity Report bereitgestellte.","Insbesondere ist relativ wenig bekannt über die Ursachen der Heterogenität, die in den Auswirkungen von typischen Sozialvergleichsexperimenten beobachtet wurden – wie etwa beim Programm Haushalt-Elektrizitäts-Report (HER) von Opower.",""
347,209,"In unserem Bericht spekulieren wir, dass Werte, die das Umweltbewusstsein betres","In unserer Studie stellen wir die Hypothese auf, dass die ökologischen Werte der Konsumentinnen und Konsumenten eine wichtige Ursache für die heterogenen Effekte sind, die bei den Teilnehmenden der Vergleichsstudie von Opower festgestellt wurden.",""
348,338,"Vor diesem Hintergru","Vor diesem Hintergrund hat das vorliegende Projekt (finanziert durch die Europäische Kommission im Rahmen der Finanzhilfevereinbarung Nr. 12345) in Partnerschaft mit dem Forschungsinstitut für Energienutzung zum Ziel, Best Practices und Empfehlungen zur Verringerung der Energiearmut zu formulieren.",""
349,437,"Vor diesem Hintergrund ","Vor diesem Hintergrund hat das vorliegende Projekt (finanziert durch die Europäische Kommission im Rahmen der Finanzhilfevereinbarung Nr. 12345) in Partnerschaft mit dem Forschungsinstitut für Energienutzung zum Ziel, Best Practices und Empfehlungen zur Verringerung der Energiearmut zu formulieren.",""
350,33,"Insbesondere über die Ursachen der Heterogenität im Kontext  e","Insbesondere ist relativ wenig bekannt über die Ursachen der Heterogenität, die in den Auswirkungen von typischen Sozialvergleichsexperimenten beobachtet wurden – wie etwa beim Programm Haushalt-Elektrizitäts-Report (HER) von Opower.",""
351,339,"Energiearmut ist zurzeit in Europa eine der grössten sozialen, technischen und gesetzlichen Herausforderungen. Davon sind schätzungsweise etwa  50 bis 125 Millionen Menschen betroffen.","Gegenwärtig ist Energiearmut eines der grössten gesellschaftlichen, technischen und rechtlichen Probleme in Europa und betrifft schätzungsweise zwischen 50 und 125 Millionen Menschen. ",""
352,371,"Im ersten Teil des Dokuments werden die Ergebnisse einer statistischen Analyse vorgestellt, die zum Ziel hatte, ""energiearme"" bzw. ""energiegefährdete"" Verbraucher zu definieren, da eine einheitliche Definition in Europa nicht existiert.","Im ersten Teil dieses Artikels werden die Resultate einer statistischen Analyse zusammengefasst, die durchgeführt wurde, um die Begriffe «energiearme» und «energiegefährdete» Konsumentinnen und Konsumenten zu definieren, da es in Europa keine einheitliche Definition gibt.",""
353,345,"Energiearmut stellt eines der grössten sozialen, technischen und gesetzlichen Herausforderungen in der aktuellen Zeit in Europa dar. Die Anzahl betroffene Personen wird auf 50 bis 125 Millionen geschätzt.","Gegenwärtig ist Energiearmut eines der grössten gesellschaftlichen, technischen und rechtlichen Probleme in Europa und betrifft schätzungsweise zwischen 50 und 125 Millionen Menschen. ",""
354,120,"Der Einfluss sozialer Informationen auf das Verhalten wurde in einer Vielzahl von Settings aufgezeigt.","Der Einfluss von sozialen Informationen auf das Verhalten wurde bereits in diversen Bereichen nachgewiesen.",""
355,11,"Vor allem ist nicht viel bekannt über die Quellen der Heterogenität, die man in Effekten von klassischen sozial","Insbesondere ist relativ wenig bekannt über die Ursachen der Heterogenität, die in den Auswirkungen von typischen Sozialvergleichsexperimenten beobachtet wurden – wie etwa beim Programm Haushalt-Elektrizitäts-Report (HER) von Opower.",""
356,25,"Das HER ","Der HER enthält verschiedene Elemente, unter anderem einen statischen Nachbarschaftsvergleich des Energieverbrauchniveaus (deskriptive Norm), Rückmeldungen dazu, wie man selbst abschneidet (injunktive Norm) und Energiespartipps.",""
357,429,"Einen der Punkte, welche das EC hervorhebt, ist, wie wichtig es ist, von Erfahrungen und besten Praktiken der verschiedenen Mitgliedsstaaten (MS) zu lernen.","Unter anderem legt die Europäische Kommission besonderen Wert darauf, von der Erfahrung und angewendeter Best Practice verschiedener EU-Mitgliedsstaaten zu lernen.",""
358,8,"Die HER besteht aus verschiedenen Elementen. Es zieht folgende Elemente mit ein: einen statischen Nachbarsvergleich des Energieverbrauchs (eine deskriptive Norm), Rückmeldung zu individuellen Leistungen (eine injunktive Norm) und Tipps zum Energie","Der HER enthält verschiedene Elemente, unter anderem einen statischen Nachbarschaftsvergleich des Energieverbrauchniveaus (deskriptive Norm), Rückmeldungen dazu, wie man selbst abschneidet (injunktive Norm) und Energiespartipps.",""
359,377,"Das Hauptproblem bei der Analysefindung ist, dass die Daten of lediglich für Standardindikatoren verwendet werden (z.B. tiefes Einkommen hohe Kosten) und dass diese Indikatoren nicht in in vielen Ländern verfügbar sind. Deshalb braucht es neue Ansätze, wie ""energieverletzliche Konsumenten definiert werden können. ","Im ersten Teil dieses Artikels werden die Resultate einer statistischen Analyse zusammengefasst, die durchgeführt wurde, um die Begriffe «energiearme» und «energiegefährdete» Konsumentinnen und Konsumenten zu definieren, da es in Europa keine einheitliche Definition gibt.",""
360,349,"Energiearmut ist eine der sozialen, technischen und rechtlichen Hauptproblematik im heutigen Europa. Es wird geschätzt, dass run 50 bis 125 Millionen Menschen davon betroffen sind.","Gegenwärtig ist Energiearmut eines der grössten gesellschaftlichen, technischen und rechtlichen Probleme in Europa und betrifft schätzungsweise zwischen 50 und 125 Millionen Menschen. ",""
361,514,"In Anbetracht dessen, zielt das hier vorgestellte Projekt, dasvon der EU Kommission ","Vor diesem Hintergrund hat das vorliegende Projekt (finanziert durch die Europäische Kommission im Rahmen der Finanzhilfevereinbarung Nr. 12345) in Partnerschaft mit dem Forschungsinstitut für Energienutzung zum Ziel, Best Practices und Empfehlungen zur Verringerung der Energiearmut zu formulieren.",""
362,70,"Der Einfluss von sozialen Informationen auf das Verhalten wurde in verschiedenen Settings gezeigt.","Der Einfluss von sozialen Informationen auf das Verhalten wurde bereits in diversen Bereichen nachgewiesen.",""
363,270,"Die Energieärmlichkeit ist eines der wichtigsten sozialen, technischen und legislativen Problmen in der heutigen Zeit in Europa. Es sind ungefähr 50 bis 125 Millionen Menschen davon betroffen.","Gegenwärtig ist Energiearmut eines der grössten gesellschaftlichen, technischen und rechtlichen Probleme in Europa und betrifft schätzungsweise zwischen 50 und 125 Millionen Menschen. ",""
364,111,"Erstens testen wir, ob der HER die individuelle Wahrnehmung von Normen im Bereich des Energiesparens beeinflusst. ","Zuerst wird getestet, ob der HER beeinflusst, wie Einzelpersonen Normen im Bereich des Energiesparens wahrnehmen.",""
365,233,"Besonders wenig weiss man über die Ursprünge der Heterogenität im Effekt von einem gut bekannten sozial vergleichenden Experiment, wie jenes von der Opower program durch den Home Electricity Report zugestellte Experiment.","Insbesondere ist relativ wenig bekannt über die Ursachen der Heterogenität, die in den Auswirkungen von typischen Sozialvergleichsexperimenten beobachtet wurden – wie etwa beim Programm Haushalt-Elektrizitäts-Report (HER) von Opower.",""
366,63,"Insbesondere ist noch relativ wenig dazu bekannt, woher Heterogenitätseffekte bei einem bekannten Experiment zum sozialen Vergleich wie dem durch das Opower-Programm mit dem Home Electricity Report durchgeführten stammen.","Insbesondere ist relativ wenig bekannt über die Ursachen der Heterogenität, die in den Auswirkungen von typischen Sozialvergleichsexperimenten beobachtet wurden – wie etwa beim Programm Haushalt-Elektrizitäts-Report (HER) von Opower.",""
367,368,"Auf dieser Grundlage beabsichtigt das Pro","Vor diesem Hintergrund hat das vorliegende Projekt (finanziert durch die Europäische Kommission im Rahmen der Finanzhilfevereinbarung Nr. 12345) in Partnerschaft mit dem Forschungsinstitut für Energienutzung zum Ziel, Best Practices und Empfehlungen zur Verringerung der Energiearmut zu formulieren.",""
368,469,"Energiearmut ist eine der sozialen, technischen und leglislativen Hauptprobleme im aktuellen Europa, da die geschätzte Zahl von betroffenen Menschen zwischen 50 und 125 Millionen liegt.","Gegenwärtig ist Energiearmut eines der grössten gesellschaftlichen, technischen und rechtlichen Probleme in Europa und betrifft schätzungsweise zwischen 50 und 125 Millionen Menschen. ",""
369,103,"Eine stärkere Wahrnehmung der Norm, Energie zu s","Eine stärkere Wahrnehmung der Norm, Energie zu sparen, könnte dann den Energieverbrauch beeinflussen.",""
370,182,"In dieser Arbeit werden wir die Hypothese aufstellen, dass eine wichtig","In unserer Studie stellen wir die Hypothese auf, dass die ökologischen Werte der Konsumentinnen und Konsumenten eine wichtige Ursache für die heterogenen Effekte sind, die bei den Teilnehmenden der Vergleichsstudie von Opower festgestellt wurden.",""
371,117,"Obwohl das Konservationsverhalten von Personen mit hohen biosphärischen Werten in der Literatur gut dokumentiert wurde, ist über die Reaktionen dieser Konsumenten auf Vergleichsgruppen wenig bekannt.","Während das Umweltschutzverhalten von Menschen mit ausgeprägten biosphärischen Werten in der Literatur gut dokumentiert ist, weiss man relativ wenig darüber, wie Konsumentinnen und Konsumenten auf Peer-Vergleiche reagieren.",""
