"rand_index","index","translation","reference_translation","accuracy"
372,433,"Vor diesem Hintergund zielt das Projekt (","Vor diesem Hintergrund hat das vorliegende Projekt (finanziert durch die Europäische Kommission im Rahmen der Finanzhilfevereinbarung Nr. 12345) in Partnerschaft mit dem Forschungsinstitut für Energienutzung zum Ziel, Best Practices und Empfehlungen zur Verringerung der Energiearmut zu formulieren.",""
373,431,"Die Europäische Kommission (EK) hat sich sehr bemüht, dieses Problem zu lösen, was beispielsweise durch die kürzliche Lancierung des EU Energy Poverty Obersvatory im Januar 2018 offensichtlich wird.","Die Europäische Kommission bemüht sich sehr, Lösungen für die Probleme zu finden, beispielsweise mit der im Januar 2018 gegründeten EU-Beobachtungsstelle für Energiearmut.",""
374,391,"Im ersten Teil des Papers werden die Ergebnisse einer statistischen Analyse zusammengefasst, die durchgeführt wurde, um ""energiearme"" und ""energiegefährdete"" Verbraucher zu definieren, da keine für ganz Europa gültige Definition existiert.","Im ersten Teil dieses Artikels werden die Resultate einer statistischen Analyse zusammengefasst, die durchgeführt wurde, um die Begriffe «energiearme» und «energiegefährdete» Konsumentinnen und Konsumenten zu definieren, da es in Europa keine einheitliche Definition gibt.",""
375,139,"Zweitens, während äussere Werte im Lauf des Lebens meist stabil bleiben, kann die umweltbezogene Selbstidentität beeinflusst werden, zum Beispiel durch Informationen zum Energiesparen.","Während ökologische Werte ein Leben lang mehr oder weniger unverändert bleiben, kann ökologische Selbstidentität beispielweise durch Informationen zu Energiesparmassnahmen beeinflusst werden.",""
376,18,"Die HER enthält verschiedene Elemente. Dazu gehören Vergleiche zum Energieverbrauch der Nachbaren (eine deskriptive norm), feedback zur individuellen norm (eine injunktive Norm) sowie energiespartipps. ","Der HER enthält verschiedene Elemente, unter anderem einen statischen Nachbarschaftsvergleich des Energieverbrauchniveaus (deskriptive Norm), Rückmeldungen dazu, wie man selbst abschneidet (injunktive Norm) und Energiespartipps.",""
377,379,"Um dieses Hinderhins zu überwinden, ist es notwendig, den Hintergrund zu definieren, hinter welchem die Pilotprojekte einbettet werden sollen (die Situation in den analysierten Mitgliedstaaten), und eine zweckdienliche Segmentierung vorzunehmen, indem die vorhandenen Statistikdaten analysiert und ausgewertet werden, welche ähnliche Indikatoren anwenden und kompatible sind mit den vorhandenen Inforationen. ","Unterschiede in den verfügbaren Datensätzen der EU-Länder führten zudem zu lückenhaften und oftmals inkompatiblen Konsumentensegmentierungen zwischen den Mitgliedsstaaten.",""
378,113,"Werte bezüglich der Umwelt bleiben mehr oder weniger gleich während unseres Lebens, aber die Selbstidentität betreffend Umwelt kann beeinflusst werden, so zum Beispiel durch Informationen über Energieverbrauch.","Während ökologische Werte ein Leben lang mehr oder weniger unverändert bleiben, kann ökologische Selbstidentität beispielweise durch Informationen zu Energiesparmassnahmen beeinflusst werden.",""
379,495,"In diesem Projekt ist das Energy Consumption Research Institu verantwortlich für das technische Training der HEAs und die Plannung der Pilot Massnahmen.","Diese HEAs werden eigens dazu ausgebildet, die Pilotmassnahmen umzusetzen und somit gefährdeten Haushalten zu zeigen, wie sie vorwiegend durch Verhaltensänderungen ihren Energieverbrauch optimieren und unter Umständen reduzieren können.",""
380,412,"Dieses Paper sammelt die ersten Resultate der oben genannten Aufgaben.","Im Rahmen dieses Projektes ist es die Aufgabe des Forschungsinstituts für Energienutzung, die HEAs fachlich auszubilden sowie die Pilotmassnahmen zu planen.",""
381,119,"Ein weiterer wichtiger offener Punkt in der Forschung ist das Verständnis darüber, ","Eine weitere Forschungslücke ist das mangelnde Verständnis für die Mechanismen hinter den Reaktionen einer Person auf den Opower-HER in Hinsicht auf ihren Energieverbrauch. ",""
382,23,"In dieser Arbeit testen wir, ob es einen sozialen Vergleichseffekt bei Energiekonservation gibt und ob dieser Effekt abhängig davon ist, ob individuelle Personen hohe Umweltansprüche haben.","In dieser Studie testen wir, ob sozialer Vergleich einen Einfluss auf das Energiesparverhalten hat und ob dieser Einfluss von der individuellen Ausprägung der ökologischen Werte abhängt.",""
383,160,"Eine weitere interessante Lücke in der Forschung besteht im Verständnisde Mechanismen, welche hinter den Reaktionen der Individuen bezüglich Opowers HER und ihrem Energieverbrauch stehen.","Eine weitere Forschungslücke ist das mangelnde Verständnis für die Mechanismen hinter den Reaktionen einer Person auf den Opower-HER in Hinsicht auf ihren Energieverbrauch. ",""
384,436,"Ein Punkt, der von der Europäischen Kommission hervorgehoben wurde, ist die Bedeutung des Lernens aus Erfahrungen und bewährten Vorgehensweisen aus anderen Mitgliedsstaaten (MS).","Unter anderem legt die Europäische Kommission besonderen Wert darauf, von der Erfahrung und angewendeter Best Practice verschiedener EU-Mitgliedsstaaten zu lernen.",""
385,15,"Die Analyse kombiniert Daten von einer grossen randomisierten Studie, die von Opower in Italien durchgeführt wurde, mit Daten einer Umfrage von ","Diese Analyse kombiniert Daten aus einer grossen randomisierten Studie von Opower in Italien mit Umfragedaten von Kundinnen und Kunden eines Energieversorgers.",""
386,89,"Ein zweiter Mechanismus könnte folglich sein, dass die im HER gelieferte Information die ökologische Selbstidentität einer Person steigert.","Ein zweiter Mechanismus könnte also sein, dass die im HER enthaltenen Informationen die ökologische Selbstidentität der Konsumentinnen und Konsumenten stärken.",""
387,220,"In diesem Paper testen wir ob es einen Effekt auf den Sozialen Vergleich der Energie Konservatin gibt und ob dieser Effekt vom Ausmass der gelebten hohen ökologischen Werte der Individuen abhängig ist.","In dieser Studie testen wir, ob sozialer Vergleich einen Einfluss auf das Energiesparverhalten hat und ob dieser Einfluss von der individuellen Ausprägung der ökologischen Werte abhängt.",""
388,340,"Die Europäische Kommision (EC) ist sehr bemüht, diese Herausforderungen anzugehen, wie beispielsweise kürzlich die Einführung des EU Energy Poverty Observatory im Januar 2018 zeigt.","Die Europäische Kommission bemüht sich sehr, Lösungen für die Probleme zu finden, beispielsweise mit der im Januar 2018 gegründeten EU-Beobachtungsstelle für Energiearmut.",""
389,203,"Ein zweiter Mechanismus könnte daher  sein, dass die Informationen, die mit dem HER übermitteltwerden, jemandes eigene Umweltidentitt vergrössern kann.","Ein zweiter Mechanismus könnte also sein, dass die im HER enthaltenen Informationen die ökologische Selbstidentität der Konsumentinnen und Konsumenten stärken.",""
390,304,"The Europäische Kommission setzt viel daran, das Thema anzugehen, wie beispielsweise der kürzlich lancierte EU Energy Poverty Observatory im Januar 2018 zeigt.","Die Europäische Kommission bemüht sich sehr, Lösungen für die Probleme zu finden, beispielsweise mit der im Januar 2018 gegründeten EU-Beobachtungsstelle für Energiearmut.",""
391,39,"Eine weitere wichtige Untersuchungslücke ist das Verständnis der Mechanismen hinter den Reaktionen der Individuen zu Opower's HER mit Einbezug ihres Energieverbrauchs.","Eine weitere Forschungslücke ist das mangelnde Verständnis für die Mechanismen hinter den Reaktionen einer Person auf den Opower-HER in Hinsicht auf ihren Energieverbrauch. ",""
392,239,"Eine weitere wichtige Lücke in der Literatur bildet da Verstehen von den Mechanismen der Reaktionen der Individuen auf das HER von Opower in Bezug auf ihre Energieverbrauch.","Eine weitere Forschungslücke ist das mangelnde Verständnis für die Mechanismen hinter den Reaktionen einer Person auf den Opower-HER in Hinsicht auf ihren Energieverbrauch. ",""
393,329,"Das grösste Hindernis bei der Durchführung dieser Analyse ist es, dass die Daten, die häufig für Standardindikatoren (bsp. niedriges einkommen, hohe Kosten), in vielen Ländern nicht verfügbar sind, sodass neue Methoden, um Energygefährdete Konsumenten zu definieren, gefunden werden müssen.","Das grösste Problem bei der Durchführung der Analyse war, dass viele Daten, die häufig als Standardindikatoren genutzt werden (z. B. niedriges Einkommen und hohe Ausgaben), in zahlreichen Ländern nicht verfügbar sind. Somit muss neu definiert werden, was energiegefährdete Konsumentinnen und Konsumenten ausmacht.",""
394,7,"Eine weitere wichtige Lücke besteht beim Verständnis der Mechanismen der Reaktionen von einzelnen Individuen in Zusammenhang mit ihrem Energieverbrauch.","Eine weitere Forschungslücke ist das mangelnde Verständnis für die Mechanismen hinter den Reaktionen einer Person auf den Opower-HER in Hinsicht auf ihren Energieverbrauch. ",""
395,14,"Der HER stärkt der Fokus der Leute auf die Verbesserung der Umwelt, indem er biosphärische Werte aktiviert.","Durch die Aktivierung von biosphärischen Werten stärkt der HER den Fokus der Konsumentinnen und Konsumenten, zum Umweltschutz beizutragen.",""
396,403,"Das Haupthdernis bei dieser Analyse besteht darin, dass die Daten, die oft für Standard-Indkatoren (z.B. niedriges Einkommen - hohe Kosten) für viele Länder nicht zur Verfügung stehen, daher mussten neue Wege erkundet werden, um energie-vulnerable KonsumentInnen zu definieren.","Das grösste Problem bei der Durchführung der Analyse war, dass viele Daten, die häufig als Standardindikatoren genutzt werden (z. B. niedriges Einkommen und hohe Ausgaben), in zahlreichen Ländern nicht verfügbar sind. Somit muss neu definiert werden, was energiegefährdete Konsumentinnen und Konsumenten ausmacht.",""
397,37,"Ein genauerer Blick auf die Norm zum Energiesparen könnte den Energieverbrauch beeinflussen.","Eine stärkere Wahrnehmung der Norm, Energie zu sparen, könnte dann den Energieverbrauch beeinflussen.",""
398,419,"Die Europische Kommission (EC) bemht sich umfassend um die Lösung desProblems, wie die  jüngste Einfhrung des EU Energy Poverty Observatory im Januar 2018 zeigt.","Die Europäische Kommission bemüht sich sehr, Lösungen für die Probleme zu finden, beispielsweise mit der im Januar 2018 gegründeten EU-Beobachtungsstelle für Energiearmut.",""
399,109,"Eine weitere ","Eine weitere Forschungslücke ist das mangelnde Verständnis für die Mechanismen hinter den Reaktionen einer Person auf den Opower-HER in Hinsicht auf ihren Energieverbrauch. ",""
400,240,"Das HER beinhaltet verschiedene Elemente, insbesondere einem statischen Nachbar-Energieverbrauch-Systems (eine deskriptive Norm), Rückmeldung der individuellen Leistung (eine injunktive Norm), sowie Energiespartipps.","Der HER enthält verschiedene Elemente, unter anderem einen statischen Nachbarschaftsvergleich des Energieverbrauchniveaus (deskriptive Norm), Rückmeldungen dazu, wie man selbst abschneidet (injunktive Norm) und Energiespartipps.",""
401,199,"Ein zweiter Ansatz dieses Berichts ist, mögliche Mechanismen zu testen, die den HEr effektiv machen.","Ein weiteres Ziel dieser Studie ist es, mögliche Mechanismen zu überprüfen, um die Wirksamkeit des HER steigern zu können.",""
402,378,"Zudem sind die unterschiedlichen, zur Verfügung stehenden Daten in EU-Ländern der Grund, weshalb eine fragmentierte und oft ""nicht kompatible"" Segmentierung in den verschiedenen Mitgliedstaaten geschieht. ","Das grösste Problem bei der Durchführung der Analyse war, dass viele Daten, die häufig als Standardindikatoren genutzt werden (z. B. niedriges Einkommen und hohe Ausgaben), in zahlreichen Ländern nicht verfügbar sind. Somit muss neu definiert werden, was energiegefährdete Konsumentinnen und Konsumenten ausmacht.",""
403,464,"Ein wichtiger Punkt, der von der ECbetont wird, ist wie wichtig es ist von Erfahrungen zu lernen und von den besten Lösungsansätzen in verschiedenen Mitgliederstaaten(MS) zu  profitieren","Unter anderem legt die Europäische Kommission besonderen Wert darauf, von der Erfahrung und angewendeter Best Practice verschiedener EU-Mitgliedsstaaten zu lernen.",""
404,331,"Um dieses Hindernis zu überwinden, ist es nötig, den Hintergrund zu ergründen, vor dem die Pliotmassnahmen angewendet werden sollen (d.h. die analyse der Situationen in den Mitgliedstaaten) und eine zielgerichtete Marktsegmentation durchzuführen, indem existierende Datenbanken analysiert und verbessert werden, auf die ","Um dieses Problem zu lösen, musste der Kontext definiert werden, in dem die Pilotmassnahmen implementiert werden sollen (die Situation in den analysierten EU-Mitgliedsstaaten). Auch musste eine zielgerichtete Marktsegmentierung durchgeführt werden, mittels einer Analyse und Ergänzung von verfügbaren Datenbeständen, welche ähnliche und kompatible Indikatoren aufweisen.",""
405,293,"Die EC betont allerdings wie wichtig es ist, von den Best Practices und den Erfahrungen der eigenen Mitgliedstaaten zu lernen. ","Unter anderem legt die Europäische Kommission besonderen Wert darauf, von der Erfahrung und angewendeter Best Practice verschiedener EU-Mitgliedsstaaten zu lernen.",""
406,384,"Vor diesem Hintergrund zielt das Projekt (das von der ","Vor diesem Hintergrund hat das vorliegende Projekt (finanziert durch die Europäische Kommission im Rahmen der Finanzhilfevereinbarung Nr. 12345) in Partnerschaft mit dem Forschungsinstitut für Energienutzung zum Ziel, Best Practices und Empfehlungen zur Verringerung der Energiearmut zu formulieren.",""
407,140,"Ein zweiter Mechanismus ist also vielleicht, dass die im HER gelieferten Informationen die umweltbezogene Selbst-Identität erh","Ein zweiter Mechanismus könnte also sein, dass die im HER enthaltenen Informationen die ökologische Selbstidentität der Konsumentinnen und Konsumenten stärken.",""
408,90,"Durch die Aktivierung von biosphärischen Werten stärkt der HER den Fokus der Personen zugunsten der Umwelt.","Durch die Aktivierung von biosphärischen Werten stärkt der HER den Fokus der Konsumentinnen und Konsumenten, zum Umweltschutz beizutragen.",""
409,235,"Die Influenz von sozialen Informationen auf das Verhalten wurde in verschiedenen Einstellungen demonstriert.","Der Einfluss von sozialen Informationen auf das Verhalten wurde bereits in diversen Bereichen nachgewiesen.",""
410,178,"Der Einfluss von sozialen Information auf Verhaltensweisen wurde in verschiedenen Szenarien gezeigt. ","Der Einfluss von sozialen Informationen auf das Verhalten wurde bereits in diversen Bereichen nachgewiesen.",""
411,163,"So konnte di Forschung beispielsweise veranschaulichen, dass die Tatsache, dass den Leuten mitgeteilt wird, wie sie im Vegleich zu anderen abschneiden,","Forschungsergebnisse zeigen beispielsweise auf, dass Personen motivierter sind, ihren Energie- und Wasserverbrauch, ihr Spenden- und Sparverhalten zu verändern, wenn ihr Verhalten mit dem von ihnen vergleichbaren Personen direkt verglichen wird.",""
412,321,"Der erste Teil dieses Artikels fasst die Resultate der statistischen Analyse zusammen, die durchgeführt wurde, um ""energy-poor"" oder ""energy-vulnerable"" Kosumenten zu definieren, da keine einheitliche europäische Definition existiert.","Im ersten Teil dieses Artikels werden die Resultate einer statistischen Analyse zusammengefasst, die durchgeführt wurde, um die Begriffe «energiearme» und «energiegefährdete» Konsumentinnen und Konsumenten zu definieren, da es in Europa keine einheitliche Definition gibt.",""
413,201,"Eine stärkere Wahrnehmung der Norm in die Richtung der Energieeinsparung könnte dann den Energieverbrauch beeinflussen.","Eine stärkere Wahrnehmung der Norm, Energie zu sparen, könnte dann den Energieverbrauch beeinflussen.",""
414,332,"Energiearmut stellt eine der grössten gesellschaftlichen, technischen und rechtlichen Herausforderungen im gegenwärtigen Europa dar. Gemäss Schätzungen sind rund 50 bis  125 Millionen Menschen in Europa von Energiearmut betroffen.","Gegenwärtig ist Energiearmut eines der grössten gesellschaftlichen, technischen und rechtlichen Probleme in Europa und betrifft schätzungsweise zwischen 50 und 125 Millionen Menschen. ",""
415,358,"Einer der von der EC ","Unter anderem legt die Europäische Kommission besonderen Wert darauf, von der Erfahrung und angewendeter Best Practice verschiedener EU-Mitgliedsstaaten zu lernen.",""
416,398,"Die Europäische Kommission (EK) hat grosse Anstrengungen unternommen, um das Problem zu lösen, wie zum Beispiel das im Januar 2018 lancierte Programm EU Energy Poverty Observatory.","Die Europäische Kommission bemüht sich sehr, Lösungen für die Probleme zu finden, beispielsweise mit der im Januar 2018 gegründeten EU-Beobachtungsstelle für Energiearmut.",""
417,408,"Ein Haupthindernis bei der Durchführung dieser Analyse ist, dass die Daten, die häufig für Standardindikatoren verwendet werden (zum Beispiel tiefes Einkommen, hohe Kosten) in vielen Ländern nicht verfügbar sind. Es mussten also neue Wege erforscht werden, um zu verstehen, was ein ""energiegefährdeter Verbraucher"" ist.","Im ersten Teil dieses Artikels werden die Resultate einer statistischen Analyse zusammengefasst, die durchgeführt wurde, um die Begriffe «energiearme» und «energiegefährdete» Konsumentinnen und Konsumenten zu definieren, da es in Europa keine einheitliche Definition gibt.",""
418,306,"Vor diesem Hintergrund versucht das hier erwähnte Projekt (von Der EU-Kommission","Vor diesem Hintergrund hat das vorliegende Projekt (finanziert durch die Europäische Kommission im Rahmen der Finanzhilfevereinbarung Nr. 12345) in Partnerschaft mit dem Forschungsinstitut für Energienutzung zum Ziel, Best Practices und Empfehlungen zur Verringerung der Energiearmut zu formulieren.",""
419,299,"Solche Ratgeber sind speziell trainiert um solche Pilotaktionen durchzuführen indem sie anfällige Konsumenten (VCs) helfen, die Energiekonsumption zu optimieren (und möglicherweise zu reduzieren), dies meist durch Einen Wechsel im Verhalten.","Dazu wird eine Reihe von Pilotmassnahmen ergriffen, gemeinsam mit einer Gruppe von Beraterinnen und Beratern, sogenannten Home Energy Advisors (HEAs).",""
420,380,"Der zweite Teil d","Um dieses Problem zu lösen, musste der Kontext definiert werden, in dem die Pilotmassnahmen implementiert werden sollen (die Situation in den analysierten EU-Mitgliedsstaaten). Auch musste eine zielgerichtete Marktsegmentierung durchgeführt werden, mittels einer Analyse und Ergänzung von verfügbaren Datenbeständen, welche ähnliche und kompatible Indikatoren aufweisen.",""
421,301,"Diese Arbeit sammelt zunächst die ersten Resultate der oben erwähnten Aufgaben.","Im Rahmen dieses Projektes ist es die Aufgabe des Forschungsinstituts für Energienutzung, die HEAs fachlich auszubilden sowie die Pilotmassnahmen zu planen.",""
422,511,"Energiearmut ist eines der Hauptprobleme im sozialen, technischen Bereich sowie in der Gesetzgebung Europas heute, wobei die Anzahl Betreoffener auf  50 bis 125 Millionen Personen geschätzt wird.","Gegenwärtig ist Energiearmut eines der grössten gesellschaftlichen, technischen und rechtlichen Probleme in Europa und betrifft schätzungsweise zwischen 50 und 125 Millionen Menschen. ",""
423,414,"Die grösste Herausforderung bei der Durchführung diese Analyse bestand darin, dass Daten oft für Standardangaben (z.B. Tiefes Einkommen Hohe Kosten) nicht in allen Ländern vorhanden sind. So mussten neue Wege gefunden werden, um ""","Im ersten Teil dieses Artikels werden die Resultate einer statistischen Analyse zusammengefasst, die durchgeführt wurde, um die Begriffe «energiearme» und «energiegefährdete» Konsumentinnen und Konsumenten zu definieren, da es in Europa keine einheitliche Definition gibt.",""
424,357,"Die Europäische Kommision (EC) setzt sich stark für die Lösung dieses Problems ein, beispelsweise mit dem jüngsten Start des Eu Energy Poverty Observatory im Januar 2018.","Die Europäische Kommission bemüht sich sehr, Lösungen für die Probleme zu finden, beispielsweise mit der im Januar 2018 gegründeten EU-Beobachtungsstelle für Energiearmut.",""
425,435,"Die Europäische Kommission bemüht sich stark, dieses Problem zu lösen, wie zum Beispiel die Kürzliche Gründung des EU Energy Povery Observatory im Januar 2018 gezeigt hat.","Die Europäische Kommission bemüht sich sehr, Lösungen für die Probleme zu finden, beispielsweise mit der im Januar 2018 gegründeten EU-Beobachtungsstelle für Energiearmut.",""
426,288,"Die European Commission (EC) hat grossen Aufwand betrieben, um dieses Problem zu lösen, wie zum Bespiel der kürzliche Launch des EU Energy Poverty Observatory im Januar 2018 gezeigt hat.","Die Europäische Kommission bemüht sich sehr, Lösungen für die Probleme zu finden, beispielsweise mit der im Januar 2018 gegründeten EU-Beobachtungsstelle für Energiearmut.",""
427,162,"Der Einfluss sozialer Informationen auf das Verhalten  konnte in mehreren Settings aufgezeigt werden.","Der Einfluss von sozialen Informationen auf das Verhalten wurde bereits in diversen Bereichen nachgewiesen.",""
428,500,"Einer der von der EK hervorgehobenen Punkte ist die Wichtigkeit des Lernens aus Erfahrung und von den besten Praktiken, die in verschiedenen Mitgliedsstaaten (MS) angewandt werden.","Unter anderem legt die Europäische Kommission besonderen Wert darauf, von der Erfahrung und angewendeter Best Practice verschiedener EU-Mitgliedsstaaten zu lernen.",""
429,124,"Trotz eines zunehmenden Interesses ","Trotz des wachsenden Interesses an sozialer Vergleichsforschung bleiben viele Fragen offen.",""
430,397,"Energiearmut ist eines der grössten sozialen, technischen und gesetzgeberischen Probleme der heutigen Zeit in Europa. Das Problem betrifft zwischen  50 und 125 Millionen Menschen.","Gegenwärtig ist Energiearmut eines der grössten gesellschaftlichen, technischen und rechtlichen Probleme in Europa und betrifft schätzungsweise zwischen 50 und 125 Millionen Menschen. ",""
431,461,"Auf dieser Grundlage zielt das hier berichtete Projekt (gegründet con der EU Kommission durch das Gran Agreement Nr.12345), ","Vor diesem Hintergrund hat das vorliegende Projekt (finanziert durch die Europäische Kommission im Rahmen der Finanzhilfevereinbarung Nr. 12345) in Partnerschaft mit dem Forschungsinstitut für Energienutzung zum Ziel, Best Practices und Empfehlungen zur Verringerung der Energiearmut zu formulieren.",""
432,492,"Der erste Teil der Studie fasst die Resultate der statistischen Analyse zusammen, welche durchgeführt wurde, um zu definieren, wer als ""energiearm"" oder ""energieverletzlich"" gilt, da es keine allgemeingültige Definition in Europa dafür gibt.","In diesem Artikel werden die ersten Resultate dieser zwei Aufgaben vorgestellt. ",""
433,133,"Obwohl das Interesse an der Forschung im Bereich des sozialen Vergleichs zunimmt, bleiben mehrere Fragen offen.","Trotz des wachsenden Interesses an sozialer Vergleichsforschung bleiben viele Fragen offen.",""
434,491,"Diese Studie sammelt die ersten Resultate der oben genannten Aufgaben.","Im Rahmen dieses Projektes ist es die Aufgabe des Forschungsinstituts für Energienutzung, die HEAs fachlich auszubilden sowie die Pilotmassnahmen zu planen.",""
435,463,"Die Europäische Kommission (EC) hat viel Aufwand investiert zum dieses Problem zu läsen, wie man zum Beispiel  am neusten Projet EU Energy Poverty Observatory sehen kann, welches Januar 2018 startete.","Die Europäische Kommission bemüht sich sehr, Lösungen für die Probleme zu finden, beispielsweise mit der im Januar 2018 gegründeten EU-Beobachtungsstelle für Energiearmut.",""
436,352,"Die Hauptschwierigkeit bei der Durchführung dieser Analyse besteht darin, das die Daten, welche für Standardindikatoren (z. B. Tiefes Einkommen Hohe Kosten) nötig sind, in vielen Ländern nicht verfügbar sind, so dass neue Wege gefunden werden müssen, um eine Defintion für energieschwache Konsumenten zu finden.","Das grösste Problem bei der Durchführung der Analyse war, dass viele Daten, die häufig als Standardindikatoren genutzt werden (z. B. niedriges Einkommen und hohe Ausgaben), in zahlreichen Ländern nicht verfügbar sind. Somit muss neu definiert werden, was energiegefährdete Konsumentinnen und Konsumenten ausmacht.",""
437,50,"Zuerst testen wir, ob der HER Report die Eindrücke eines Individuums von der Norm im Bereich Energiesparen.","Zuerst wird getestet, ob der HER beeinflusst, wie Einzelpersonen Normen im Bereich des Energiesparens wahrnehmen.",""
438,502,"Mit diesem Hintergrund versucht das hier vorgestellte Projekt, das von der EU Kommission unter dem Grant Agreement 12345 finanziert wurde und welches das Consumption Resaerch Institute als Partner hat,die besten Praktiken und Empfehlungen zu finden um Energiarmut anzugehen.","Vor diesem Hintergrund hat das vorliegende Projekt (finanziert durch die Europäische Kommission im Rahmen der Finanzhilfevereinbarung Nr. 12345) in Partnerschaft mit dem Forschungsinstitut für Energienutzung zum Ziel, Best Practices und Empfehlungen zur Verringerung der Energiearmut zu formulieren.",""
439,218,"In unserem Paper stellen wir die Hypothese, dass eine wichtige Quelle von heterogenen Effekten, welche in der Opower peer comparison beobachtet wurden, die umwelttechnischen Werte von KonsumentInnen sein könnte.","In unserer Studie stellen wir die Hypothese auf, dass die ökologischen Werte der Konsumentinnen und Konsumenten eine wichtige Ursache für die heterogenen Effekte sind, die bei den Teilnehmenden der Vergleichsstudie von Opower festgestellt wurden.",""
